{
  "framework": "levels-of-interoperability",
  "version": "0.1.0",
  "lastUpdated": "2026-05-22",
  "entries": [
    {
      "id": "S01",
      "order": 10,
      "name": "Entity definitions list",
      "category": "reference-resource",
      "description": "Documented, growing list of entity types relevant to heritage science (objects, people, organisations, samples, methods, equipment, results, documents, etc.) with descriptions and scope notes.",
      "handlesResources": ["R03", "R04", "R05", "R06", "R07", "R08", "R09", "R10", "R11", "R12", "R14", "R15"],
      "supportsLevels": ["T03", "T04a", "T04b"],
      "supportsLevelsNotes": "T03 to T04b range.",
      "enablesTransitions": ["X02"],
      "enablesTransitionsNotes": "Provides the conceptual basis for any schema work above T02.",
      "currentStatus": "emerging",
      "currentStatusNotes": "Partial across initiatives, needs consolidation.",
      "ownersAndInitiatives": "HPSWG-Models, HSDS, E-RIHS DIGILAB, aggregator communities.",
      "notes": "Foundational artefact, prerequisite for most other work."
    },
    {
      "id": "S02",
      "order": 20,
      "name": "Standardised metadata schemas",
      "category": "reference-resource",
      "description": "Documented field definitions for each entity, with required and optional fields, priority indicators, and impact notes.",
      "handlesResources": ["R03", "R04", "R05", "R06", "R07", "R08", "R09", "R10", "R11", "R12", "R13", "R14", "R15", "R16"],
      "handlesResourcesNotes": "R03 through R16.",
      "supportsLevels": ["T03", "T04a", "T04b"],
      "enablesTransitions": ["X02", "X03", "X04", "X07"],
      "enablesTransitionsNotes": "Defines what T03 and T04b mean in practice for each entity.",
      "currentStatus": "emerging",
      "currentStatusNotes": "Partial, fragmented across communities (Spectrum, LIDO, project-specific schemas).",
      "ownersAndInitiatives": "Collections Trust, aggregator communities, project-specific groups.",
      "notes": "The bridge between entity definitions and practical recording."
    },
    {
      "id": "S03",
      "order": 30,
      "name": "Reference vocabularies",
      "category": "reference-resource",
      "description": "Published, reusable controlled vocabularies for the values used in metadata schemas.",
      "handlesResources": ["R13"],
      "handlesResourcesNotes": "R13, plus values within most other resources.",
      "supportsLevels": ["T05"],
      "enablesTransitions": ["X05"],
      "enablesTransitionsNotes": "Enables T05 by providing the vocabularies to align against.",
      "currentStatus": "established",
      "currentStatusNotes": "Strong for some domains (AAT, Wikidata), gaps in heritage science specifics.",
      "ownersAndInitiatives": "Getty, Wikidata, domain-specific thesaurus communities.",
      "notes": "Domain-specific gaps need community work."
    },
    {
      "id": "S04",
      "order": 40,
      "name": "Recommended semantic templates",
      "category": "reference-resource",
      "description": "Documented, community-endorsed modelling patterns showing how entities and relationships are expressed in CIDOC CRM and its extensions.",
      "handlesResources": ["R03", "R04", "R05", "R06", "R07", "R08", "R09", "R10", "R11", "R12", "R13", "R14", "R15", "R16"],
      "handlesResourcesNotes": "R03 through R16 once at T04b.",
      "supportsLevels": ["T07b"],
      "enablesTransitions": ["X09", "X10"],
      "enablesTransitionsNotes": "Enables T07b by providing the patterns, supports automated lifts from T04b/T06+.",
      "currentStatus": "emerging",
      "currentStatusNotes": "In active development through HPSWG-Models, alignment with CRM-SIG pending.",
      "ownersAndInitiatives": "HPSWG-Models, CRM-SIG, E-RIHS DIGILAB.",
      "notes": "Core to the templates/recommended implementations work."
    },
    {
      "id": "S05",
      "order": 50,
      "name": "Schema-to-schema mapping tools",
      "category": "tooling",
      "description": "Automated or semi-automated tools to map between different shared schemas (Spectrum to LIDO, institutional schemas to aggregator schemas, etc.).",
      "handlesResources": ["R03", "R04", "R05", "R06", "R07", "R08", "R09", "R10", "R11", "R12", "R13", "R14", "R15", "R16"],
      "handlesResourcesNotes": "R03 through R16.",
      "supportsLevels": ["T03", "T04a", "T04b"],
      "enablesTransitions": ["X03", "X04", "X14"],
      "enablesTransitionsNotes": "Lowers the barrier to schema alignment.",
      "currentStatus": "emerging",
      "currentStatusNotes": "Some exist (aggregator-specific), few are generic.",
      "ownersAndInitiatives": "Aggregators (ArtUK, Museum Data Service, Europeana), institutional IT.",
      "notes": "Crosswalk infrastructure."
    },
    {
      "id": "S06",
      "order": 60,
      "name": "Schema-to-vocabulary mapping tools",
      "category": "tooling",
      "description": "Tools that suggest or apply mappings from local terminology to published vocabularies.",
      "handlesResources": ["R13"],
      "handlesResourcesNotes": "R13, plus vocabulary-controlled fields.",
      "supportsLevels": ["T05"],
      "enablesTransitions": ["X05", "X14"],
      "enablesTransitionsNotes": "Enables T05 without requiring manual remapping of legacy data.",
      "currentStatus": "emerging",
      "currentStatusNotes": "Some exist for specific vocabulary pairs, fragmented.",
      "ownersAndInitiatives": "Vocabulary providers, aggregators.",
      "notes": "Often a major barrier to T05 adoption."
    },
    {
      "id": "S07",
      "order": 70,
      "name": "PID minting and registration services",
      "category": "infrastructure",
      "description": "Services that issue and register persistent identifiers for resources and entities.",
      "handlesResources": ["R03", "R05", "R06", "R07", "R08", "R10", "R11", "R12", "R16"],
      "supportsLevels": ["T06"],
      "enablesTransitions": ["X06"],
      "enablesTransitionsNotes": "Enables T06 by providing the identifier infrastructure.",
      "currentStatus": "established",
      "currentStatusNotes": "Strong for some PID types (DOI, ORCID, ROR), emerging for others (IGSN for samples).",
      "ownersAndInitiatives": "DataCite, Crossref, ORCID, IGSN/SESAR, ROR, Handle, ARK communities.",
      "notes": "Coverage varies by PID type and resource."
    },
    {
      "id": "S08",
      "order": 80,
      "name": "Automatic metadata-to-semantic mapping tools",
      "category": "tooling",
      "description": "Tools that take metadata at T04b or T06+ and produce semantic representation at T07b using recommended templates.",
      "handlesResources": ["R03", "R04", "R05", "R06", "R07", "R08", "R09", "R10", "R11", "R12", "R13", "R14", "R15", "R16"],
      "handlesResourcesNotes": "R03 through R16 once at T04b.",
      "supportsLevels": ["T04b", "T06+", "T07b"],
      "enablesTransitions": ["X09", "X10", "X14"],
      "enablesTransitionsNotes": "Enables the jump from rich metadata to semantic representation without manual modelling.",
      "currentStatus": "prototype",
      "currentStatusNotes": "Early stage, some prototypes.",
      "ownersAndInitiatives": "HPSWG-Models tooling, EasyRDF-based converters, research projects.",
      "dependsOn": ["S04"],
      "notes": "Critical for making T07b achievable at scale."
    },
    {
      "id": "S09",
      "order": 90,
      "name": "Knowledge graph platforms (ResearchSpace, Arches, others)",
      "category": "platform",
      "description": "Platforms that host, edit, and serve semantic representations.",
      "handlesResources": ["R03", "R04", "R05", "R06", "R07", "R08", "R09", "R10", "R11", "R12", "R13", "R14", "R15", "R16"],
      "handlesResourcesNotes": "R03 through R16 at T07b and T08b.",
      "supportsLevels": ["T07b", "T08a", "T08b"],
      "enablesTransitions": ["X08", "X09", "X12"],
      "enablesTransitionsNotes": "Provide the working environment for semantically represented data.",
      "currentStatus": "mature",
      "currentStatusNotes": "Mature (ResearchSpace, Arches), well-adopted in heritage and conservation.",
      "ownersAndInitiatives": "ResearchSpace community, Getty/Arches community.",
      "notes": "Integration with mapping tools is the practical bridge."
    },
    {
      "id": "S10",
      "order": 100,
      "name": "Linked data publication infrastructure",
      "category": "infrastructure",
      "description": "SPARQL endpoints, linked data fragments, IIIF endpoints, federation registries.",
      "handlesResources": ["R03", "R04", "R05", "R06", "R07", "R08", "R09", "R10", "R11", "R12", "R13", "R14", "R15", "R16"],
      "handlesResourcesNotes": "R03 through R16 at T08.",
      "supportsLevels": ["T07b", "T08a", "T08b"],
      "enablesTransitions": ["X11", "X12"],
      "enablesTransitionsNotes": "Enables federation by providing the publication layer.",
      "currentStatus": "established",
      "currentStatusNotes": "Mature in some communities, fragmented in heritage science.",
      "ownersAndInitiatives": "Various institutional and research infrastructures.",
      "notes": "Coordination across infrastructures is the gap."
    },
    {
      "id": "S11",
      "order": 110,
      "name": "Specific documented Digital Twin models",
      "category": "reference-resource",
      "description": "Documented specifications for what constitutes a Digital Twin in a given context, including required components, structure, and use cases.",
      "handlesResources": ["R03", "R04", "R05", "R06", "R07", "R08", "R09", "R10", "R11", "R12", "R13", "R14", "R15", "R16"],
      "handlesResourcesNotes": "R03 through R16 at T08b plus integration spec.",
      "supportsLevels": ["T09"],
      "enablesTransitions": ["X13"],
      "enablesTransitionsNotes": "Defines what T09 means in practice for a given domain or use case.",
      "currentStatus": "conceptual",
      "currentStatusNotes": "Emerging, definitions still contested.",